id_in_session,code,label,finished,time_started_utc,associations,consent,association1,association2,association3,association4,association5,ai_trust,ai_risk,daily_ai_use,ai_expertise,ai_expertise_justification,age,gender,gender_self_describe,illusion_response,include_data,include_data_justification,ai_use_survey,feedback,honeypot_checkbox,prolific_id,recaptcha_score
1,vvv59zr0,628f83dc5398c04bac86f9e6,True,2025-10-16 13:59:18.052570,"{'association1': 'reliable', 'association2': 'fast', 'association3': 'convenient', 'association4': 'striking', 'association5': 'engaging'}",1.0,reliable,fast,convenient,striking,engaging,8.0,6.0,7.0,7.0,So I work with AI a lot not as much for my regular job as a teacher but for side stuff. ,40.0,male,,duck,yes,,yes,none,,628f83dc5398c04bac86f9e6,0.9
2,o1tewpz9,55ed87f0748092000baa9a0b,True,2025-10-16 13:59:41.735543,"{'association1': 'cognition', 'association2': 'reasoning', 'association3': 'technology', 'association4': 'privacy', 'association5': 'security'}",1.0,cognition,reasoning,technology,privacy,security,5.0,8.0,10.0,7.0,I work with various forms of AI programming as a hobby. I am paid to train various kinds of AI.,50.0,male,,duck,yes,,yes,No comment,,55ed87f0748092000baa9a0b,0.9
4,ynd1a9u2,612fde55d251a3547b8e5766,True,2025-10-16 13:59:42.348762,"{'association1': 'Chat gpt', 'association2': 'Efficiency', 'association3': 'Smart', 'association4': 'Answers', 'association5': 'Technology '}",1.0,Chat gpt,Efficiency,Smart,Answers,Technology ,9.0,8.0,10.0,9.0,I use AI every day with my job and personal life. I love using it to understand my data,32.0,male,,Duck ,yes,,yes,N.a,,612fde55d251a3547b8e5766,0.9
6,ldwme93h,6650a38d75c08f70233642b1,True,2025-10-16 14:00:49.266817,"{'association1': 'make life easier', 'association2': 'take away jobs', 'association3': 'new opportunities', 'association4': 'environment costs', 'association5': 'rapid growth'}",1.0,make life easier,take away jobs,new opportunities,environment costs,rapid growth,7.0,8.0,6.0,6.0,I know enough to interact with Generative AI such as ChatGPT and to recognize when I am interacting with AI.  I am not an AI developer.,57.0,male,,duck,yes,,no,,,6650a38d75c08f70233642b1,0.9
7,vqi0l8vw,614dd304ed948bbfe8c22215,True,2025-10-16 14:01:02.582087,"{'association1': 'Smart', 'association2': 'Fake', 'association3': 'Scary', 'association4': 'Weird', 'association5': 'Interesting'}",1.0,Smart,Fake,Scary,Weird,Interesting,5.0,3.0,3.0,3.0,I do not know much about it. I only have used it a few times.,36.0,female,,duck,yes,,no,N/a,,614dd304ed948bbfe8c22215,0.9
8,a3ybdhvo,5cd31d68db60cb0017d4ac33,True,2025-10-16 14:01:23.712350,"{'association1': 'scary', 'association2': 'overtaking', 'association3': 'Isaac Asimov', 'association4': 'scifi', 'association5': 'job loss'}",1.0,scary,overtaking,Isaac Asimov,scifi,job loss,1.0,0.0,0.0,4.0,I know what AI is and that people interact with it as though it is human through certain apps. I know that sometimes online representatives are actually AI but I don't *choose* to interact with them. AI can  - and searches admit - be absolutely incorrect. I feel most of it is just data mining that's more straightforward than in the past.,56.0,female,,duck,yes,,no,I know there's a famous optical illusion regarding the duck/rabbit question but by golly I know a duck when I see one! LOL,,5cd31d68db60cb0017d4ac33,0.9
9,ripw9l2o,66eb1a41306925cf993d6490,True,2025-10-16 14:01:27.917716,"{'association1': 'Possibilities ', 'association2': 'Fear ', 'association3': 'Positive outcomes', 'association4': 'Negative Outcomes ', 'association5': 'Shaping the Future'}",1.0,Possibilities ,Fear ,Positive outcomes,Negative Outcomes ,Shaping the Future,5.0,3.0,4.0,5.0,"I have been educated on it and worked with it on things related to the IT and Cyber Security field, I use it sometimes but I normally like to do things without it if possible/allowed, sometimes I have no choice for the one area I have decent knowledge of the AI we use but I would say I don't have in depth knowledge of it or other AI.",37.0,male,,duck,yes,,no,No comment.,,66eb1a41306925cf993d6490,0.9
10,u96eqlti,6631056349b08a35aae1ac5f,True,2025-10-16 14:02:18.959893,"{'association1': 'Climate catastrophe ', 'association2': 'Water usage ', 'association3': 'Art theft', 'association4': 'Intelectual property theft', 'association5': 'Dumbing down'}",1.0,Climate catastrophe ,Water usage ,Art theft,Intelectual property theft,Dumbing down,0.0,1.0,0.0,10.0,I have used and trained LLMs and helped with coding ,39.0,non_binary,,Duck,yes,,no,No feedback ,,6631056349b08a35aae1ac5f,0.9
13,8j6g95br,6021522cc0eec00d2e4ab6c7,True,2025-10-16 14:05:46.672945,"{'association1': 'glorified search engine', 'association2': 'next dot com bubble', 'association3': 'highly useful', 'association4': 'not intelligent', 'association5': 'new shiny toy'}",1.0,glorified search engine,next dot com bubble,highly useful,not intelligent,new shiny toy,5.0,5.0,5.0,3.0,"I know enough to be confident using it, but not all the details on how it ticks.",35.0,non_binary,,duck,yes,,no,No,,6021522cc0eec00d2e4ab6c7,0.9
14,rn6vgoso,67f015260f679212b3c34caa,True,2025-10-16 14:06:08.287226,"{'association1': 'Efficient', 'association2': 'Smart/intelligent', 'association3': 'convinient', 'association4': 'my helper', 'association5': ''}",1.0,Efficient,Smart/intelligent,convinient,my helper,,8.0,10.0,8.0,6.0,"I have a general knowledge of how AI works and its common applications. I use AI tools in my work and personal life in tasks like brainstorming, writing and image generation",48.0,female,,a duck,yes,,no,no comment,,67f015260f679212b3c34caa,0.9
15,kdo08osb,66d1fdd400acfdbc181f41e0,True,2025-10-16 14:07:23.191774,"{'association1': 'chat gpt', 'association2': 'chat bot', 'association3': 'hallucinations', 'association4': 'a little wary', 'association5': 'must check output always'}",1.0,chat gpt,chat bot,hallucinations,a little wary,must check output always,5.0,4.0,8.0,6.0,I use 3 different models usually daily to create and brainstorm for various tasks.,51.0,male,,duck,yes,,no,none,,66d1fdd400acfdbc181f41e0,0.9
16,c3mm7fkp,615914a33224dc31f1045612,True,2025-10-16 14:09:04.661048,"{'association1': 'Intelligent ', 'association2': 'problem solver', 'association3': 'the future', 'association4': 'game changer', 'association5': 'Trustworthy '}",1.0,Intelligent ,problem solver,the future,game changer,Trustworthy ,10.0,8.0,10.0,5.0,"I basically just know the basics. I use it for problem solving, getting answers to questions, and getting information on different things.",65.0,male,,duck,yes,,no,Thank you,,615914a33224dc31f1045612,0.9
17,9jqku76a,5df4ed2eae7b303760a9d47c,True,2025-10-16 14:09:55.404611,"{'association1': 'gemini', 'association2': 'midjourney', 'association3': 'leonardo', 'association4': 'nano banana', 'association5': 'chatgpt'}",1.0,gemini,midjourney,leonardo,nano banana,chatgpt,7.0,7.0,7.0,6.0,I have used ai to generate images for sticker designs for my shop by entering prompts. I have also used chatgpt mostly when asked to use in online surveys,54.0,female,,duck,yes,,no,thanks,,5df4ed2eae7b303760a9d47c,0.9
18,k8wljbmv,62349dcdec7c3f8e7e1bc90b,True,2025-10-16 14:10:51.986645,"{'association1': 'computers', 'association2': 'algorythm', 'association3': 'machine learning', 'association4': 'artificial', 'association5': 'technology'}",1.0,computers,algorythm,machine learning,artificial,technology,5.0,6.0,6.0,6.0,I am a writer and I use AI sometimes for research. I have found that it can be helpful but you most definitely have to fact check it because it's sometimes wrong,55.0,female,,duck,yes,,no,Straightforward study. No issues,,62349dcdec7c3f8e7e1bc90b,0.9
19,4zltjmsn,5c9ebf067114700016da2813,True,2025-10-16 14:12:24.205067,"{'association1': 'copying', 'association2': 'fake', 'association3': 'crawling the web', 'association4': 'seeking', 'association5': 'artifical'}",1.0,copying,fake,crawling the web,seeking,artifical,3.0,5.0,3.0,4.0,I usually can tell when something is AI and know a bit about it.,34.0,male,,duck,yes,,no,none,,5c9ebf067114700016da2813,0.9
20,wqz6cuom,674530631263934b181d3224,True,2025-10-16 14:12:41.640796,"{'association1': 'Creative writing', 'association2': 'Brainstorming', 'association3': 'Productivity', 'association4': 'Developing fast', 'association5': 'Inevitable'}",1.0,Creative writing,Brainstorming,Productivity,Developing fast,Inevitable,6.0,8.0,8.0,6.0,"I use AI systems frequently, my experience is more practical than academic. But I understand what AI is, the basics of how it works and probably more importantly, I know what it isn't.",36.0,male,,duck,yes,,no,Thank you for the opportunity.,,674530631263934b181d3224,0.9
22,kss94mwy,5c28dd50da51990001e31d86,True,2025-10-16 14:13:40.236993,"{'association1': 'Intelligent', 'association2': 'Creative', 'association3': 'Useful', 'association4': 'Innovative', 'association5': 'Helpful'}",1.0,Intelligent,Creative,Useful,Innovative,Helpful,8.0,7.0,3.0,5.0,I use it occasionally for personal use and at work. I haven't gotten too involved with the creative aspects of AI as I would like to. I imagine in the future I will AI more frequently for various things.,55.0,male,,duck,yes,,no,Thank you.,,5c28dd50da51990001e31d86,0.9
23,pll21c4s,66cec5a3fdf1fe2c010e9971,True,2025-10-16 14:14:47.713525,"{'association1': 'it is the assit of computers ', 'association2': 'use of machine to make deccisions ', 'association3': 'assit in various task', 'association4': 'help line to variuos tasks ', 'association5': 'help in working'}",1.0,it is the assit of computers ,use of machine to make deccisions ,assit in various task,help line to variuos tasks ,help in working,7.0,5.0,7.0,7.0,i use atrificial intelligence in my line of work ,50.0,female,,duck,yes,,no,no comments,,66cec5a3fdf1fe2c010e9971,0.7
24,xaqlzx4z,66bdf79c29a4dd71ff4de0d0,True,2025-10-16 14:21:41.841668,"{'association1': 'technology', 'association2': 'futuristic', 'association3': 'helpful', 'association4': 'productivity', 'association5': 'energy'}",1.0,technology,futuristic,helpful,productivity,energy,7.0,6.0,8.0,6.0,"I am a regular user of AI and know a lot about how to use it. However, I don't know that much about building it or the back end.",30.0,female,,duck,yes,,no,none,,66bdf79c29a4dd71ff4de0d0,0.9
25,7wyifw91,66f9a40196d53f05f2232cff,True,2025-10-16 14:42:05.107078,"{'association1': 'technology', 'association2': 'future', 'association3': 'advanced tech', 'association4': 'helpful', 'association5': 'job loss'}",1.0,technology,future,advanced tech,helpful,job loss,7.0,5.0,4.0,4.0,I use AI occasionally but only for basic answers or help. I don't have extensive knowledge about it.,49.0,female,,duck,yes,,no,Thanks for the opportunity to participate!,,66f9a40196d53f05f2232cff,0.9
